<?xml version="1.0" encoding="UTF-8"?>

<!-- %W  main.xml        GAP 4 Tutorial        ... -->
<!-- %Y  Copyright 1997, Lehrstuhl D für Mathematik, RWTH Aachen, Germany -->

<!DOCTYPE Book SYSTEM "gapdoc.dtd"
   [ <!ENTITY ATLAS "<Package>Atlas</Package>">
     <!ENTITY mdash "<Alt Only='HTML'>&#8212;</Alt><Alt Not='HTML'>---</Alt>">
<#Include SYSTEM "../versiondata">
   ]>

<?LaTeX ExtraPreamble="
"?>

<Book Name="tut">
<TitlePage>
  <Title>GAP &mdash; A Tutorial</Title>
  <Version>Release &VERSIONNUMBER;, &RELEASEDAY;</Version>
  <Author>The GAP Group
    <Email>support@gap-system.org</Email>
    <Homepage>https://www.gap-system.org</Homepage>
  </Author>

  <Copyright>
    Copyright &copyright; (1987-&RELEASEYEAR;)
    for the core part of the &GAP; system by its authors.
    <P/>
    Most parts of this distribution, including the core part of the &GAP;
    system are distributed under the terms of the GNU General Public License,
    version 2 or (at your option) any later version,
    see <URL>https://www.gnu.org/licenses/old-licenses/gpl-2.0.html</URL> or the
    <F>LICENSE</F> file in the root directory of the &GAP;
    installation.
    <P/>
    More detailed information about copyright and licenses of parts of this
    distribution can be found in <Ref Sect="Copyright and License" BookName="ref"/>.
    <P/>
    &GAP; is developed over a long time and has many authors and contributors.
    More detailed information can be found in
    <Ref Sect="Authors and Maintainers" BookName="ref"/>.
  </Copyright>
</TitlePage>

<TableOfContents/>

<Body>

<#Include SYSTEM "preface.xml">
<#Include SYSTEM "introduc.xml">
<#Include SYSTEM "lists.xml">
<#Include SYSTEM "function.xml">
<#Include SYSTEM "group.xml">
<#Include SYSTEM "algvspc.xml">
<#Include SYSTEM "domain.xml">
<#Include SYSTEM "opers.xml">

</Body>

<Bibliography Databases="../manualbib.xml"/>

<TheIndex/>

</Book>

<!-- ==================================================================== -->

